{
  "$schema": "https://json-schema.org/draft/2020-12/schema",
  "$id": "https://raw.githubusercontent.com/product-on-purpose/critique-skills/main/bench/results/results.schema.json",
  "title": "Bench results",
  "description": "Every computed number for one run set, produced by `python -m bench.metrics score` from committed manifests and run envelopes and nothing else. The README results table (bench/report.py) is generated from this file and only this file: no number appears in any document in this repository that is not present here. This file is results version 1.3.0 and validates 1.x documents only.",
  "$comment": "Results version 1.1.0. `entries[]` holds one row per (skill, skill_version, model, domain) group, baseline rows included: a baseline run carries skill \"baseline-generic\" in the same array, at the same shape, so a report script computes a skill-versus-baseline comparison by matching (domain, model) pairs rather than reading a separately stored, and therefore possibly stale, comparison table. 1.1.0 added recall_location and precision_location (P3 rescore, bench/results/README.md, \"Baseline comparison\"): recall.value and precision.value require an exact criterion-string match between a finding and a planted defect, which pins baseline-generic at exactly 0.0 everywhere because every baseline finding carries the fixed criterion BASELINE-GENERIC that no manifest plants a defect under; recall_location and precision_location apply the same per-artifact-type location tolerance with the criterion check dropped, so a skill and the baseline can be compared on whether either one pointed at the right place at all. Additive and backward-compatible: every 1.0.0 field keeps its old meaning and value.",
  "type": "object",
  "required": [
    "results_version",
    "run_set",
    "generated_at",
    "entries"
  ],
  "additionalProperties": false,
  "properties": {
    "results_version": {
      "$ref": "#/$defs/resultsVersion"
    },
    "run_set": {
      "title": "Run set identifier",
      "description": "A label for the file as a whole. For a single-run-set file it matches the directory name under bench/results/ the file describes. For a file that concatenates run sets it is only a label, and the per-entry run_set field added in results_version 1.2.0 is the authoritative answer to which run set produced a given number.",
      "type": "string",
      "minLength": 1,
      "maxLength": 128,
      "pattern": "^[a-z0-9]+(?:-[a-z0-9]+)*(?![\\s\\S])"
    },
    "generated_at": {
      "$ref": "#/$defs/timestamp",
      "description": "When `python -m bench.metrics score` produced this file."
    },
    "entries": {
      "title": "Scored entries",
      "description": "One entry per (skill, skill_version, model, domain) group actually present in --runs. Empty is valid: a run set with no matched envelopes produces an empty array rather than an error, so an incomplete run set is still a well-formed file.",
      "type": "array",
      "uniqueItems": true,
      "items": {
        "$ref": "#/$defs/entry"
      }
    }
  },
  "$defs": {
    "entry": {
      "title": "One scored (skill, model, domain) group",
      "type": "object",
      "required": [
        "skill",
        "skill_version",
        "model",
        "domain",
        "run_set",
        "lane",
        "artifact_type",
        "artifacts_scored",
        "unresolvable_claims",
        "recall",
        "precision",
        "recall_location",
        "precision_location",
        "clean_fp_rate",
        "consistency",
        "consistency_exact"
      ],
      "additionalProperties": false,
      "properties": {
        "skill": {
          "title": "Skill name",
          "description": "The emitting skill, matching the contract's run.skill: \"critique-clarity\", or \"baseline-generic\" for the frozen baseline comparison.",
          "type": "string",
          "maxLength": 64,
          "pattern": "^[a-z0-9]+(?:-[a-z0-9]+)*(?![\\s\\S])"
        },
        "skill_version": {
          "$ref": "#/$defs/semver"
        },
        "model": {
          "title": "Model ID",
          "description": "Exact pinned model identifier, matching the contract's run.model. Benchmark numbers are only honest if this is pinned.",
          "type": "string",
          "maxLength": 128,
          "minLength": 1
        },
        "domain": {
          "title": "Domain",
          "description": "The bench domain scored, matching manifest.schema.json's domain field.",
          "type": "string",
          "maxLength": 64,
          "pattern": "^[a-z0-9]+(?:-[a-z0-9]+)*(?![\\s\\S])"
        },
        "run_set": {
          "title": "Run set this entry was scored from",
          "description": "The run set whose envelopes produced this entry. Present per entry because a committed results.json may concatenate more than one run set, which the single top-level run_set cannot describe: before 1.2.0 the committed file carried the invented identifier 'p3-2026-07-31-plus-cal1-2026-08-01' for exactly that reason.",
          "type": "string",
          "minLength": 1,
          "maxLength": 128,
          "pattern": "^[a-z0-9]+(?:-[a-z0-9]+)*(?![\\s\\S])"
        },
        "lane": {
          "title": "Finding lane this entry scores",
          "description": "Which lane's findings were scored. 'overall' is every finding and is the cut every published figure reports. 'judged' and 'scripted' are the same envelopes with findings filtered to that lane before scoring, which before 1.2.0 could only be obtained by a documented monkeypatch recipe rather than read out of the committed file.",
          "type": "string",
          "enum": [
            "overall",
            "judged",
            "scripted"
          ]
        },
        "artifact_type": {
          "title": "Artifact type",
          "description": "The location-tolerance rule this domain's artifacts use, matching manifest.schema.json's artifactType.",
          "type": "string",
          "enum": [
            "markdown-prose",
            "markdown-tree",
            "html",
            "string-list"
          ]
        },
        "artifacts_scored": {
          "title": "Artifacts scored",
          "description": "How many (manifest, envelope) pairs contributed to this entry's recall, precision, and clean_fp_rate. Not necessarily the corpus's full artifact count for this domain: an entry only reflects the envelopes actually present under --runs.",
          "type": "integer",
          "minimum": 0
        },
        "unresolvable_claims": {
          "title": "Unresolvable claims",
          "description": "Count of claims whose location resolved to no anchor at all, summed across every scored artifact in this entry. Reported per S-03 OQ-1's RC review question: whether the resolver's parse failures are common enough to distort the numbers. An unresolvable claim is still a miss for recall and still counts against precision; this field does not change either computation, it only makes the size of that approximation visible.",
          "type": "integer",
          "minimum": 0
        },
        "recall": {
          "$ref": "#/$defs/metricValue",
          "description": "Criterion-level recall: matched planted defects, over planted defects, where a match requires exact criterion-string equality plus a location within the artifact type's tolerance (bench/README.md, \"Recall\"). Primary for a skill: it measures rubric operationalization, whether the skill named the defect under the criterion the rubric assigns it, not only whether it noticed something at the right place. Pinned at 0.0 for baseline-generic by construction; see recall_location for the comparison that is not."
        },
        "precision": {
          "$ref": "#/$defs/metricValue",
          "description": "Criterion-level precision: claims matched to a planted defect under the same criterion-plus-location predicate as recall, over all claims emitted (bench/README.md, \"Precision\"). Pinned at 0.0 for baseline-generic by construction; see precision_location."
        },
        "recall_location": {
          "$ref": "#/$defs/metricValue",
          "description": "Location-level recall: matched planted defects, over planted defects, where a match requires only a location within the artifact type's tolerance, criterion ID ignored entirely (bench/metrics/score.py, score_artifact_location). Computed from the same envelopes as recall, no new runs. This is the fair cross-condition figure: baseline-generic findings carry no rubric criterion, so criterion-level recall could not have been anything but 0.0 no matter what the model wrote, and recall_location is the number that is not pinned by that construction."
        },
        "precision_location": {
          "$ref": "#/$defs/metricValue",
          "description": "Location-level precision: claims matched to a planted defect by location alone, criterion ID ignored, over all claims emitted (bench/metrics/score.py, score_artifact_location). Computed from the same envelopes as precision, no new runs. Read beside precision the same way recall_location is read beside recall."
        },
        "clean_fp_rate": {
          "$ref": "#/$defs/metricValue",
          "description": "Mean claims per clean artifact (bench/README.md, \"False positives on clean artifacts\"). Reported separately from precision because it isolates the behavior that matters most to a user: what the skill says about a document with nothing wrong with it."
        },
        "consistency": {
          "$ref": "#/$defs/consistencyValue",
          "description": "Mean pairwise Jaccard, tolerance-aware, over k runs of the same skill against the same artifact, averaged with equal weight across every scored artifact that had at least two runs to compare."
        },
        "consistency_exact": {
          "$ref": "#/$defs/consistencyValue",
          "description": "The same aggregation as consistency, computed with zero tolerance on the canonical (criterion, key) sets. The gap between consistency and consistency_exact is the skill's location-phrasing instability."
        },
        "severity_agreement": {
          "$ref": "#/$defs/metricValue",
          "description": "Added in results_version 1.3.0 (E22). Of the criterion-level matches that produced recall, the share whose claim carries exactly the severity the manifest planted the defect at (severity_expected, 1 to 4). It reads only matched pairs, so it measures whether a found defect was rated right, not whether defects were found. Null for baseline-generic by construction, because it has no criterion-level matches. Optional so that 1.2.0 documents still validate."
        }
      },
      "description": "Since results_version 1.2.0 an entry is identified by (skill, skill_version, model, domain, run_set, lane); before that it was the first four, and a file holding two run sets could not say which entry came from which."
    },
    "metricValue": {
      "title": "A ratio, plus the integers it was formed from",
      "description": "value is null when denominator is 0: the metric is not computable from what was scored, a different claim from \"scored and found to be zero\". Value, when not null, is rounded to three decimal places (bench/README.md, \"Metrics\": \"a ratio is formed once, at the end, and reported to three decimal places\"); numerator and denominator are the exact integers the ratio was formed from, so the rounding is always auditable.",
      "type": "object",
      "required": [
        "value",
        "numerator",
        "denominator"
      ],
      "additionalProperties": false,
      "properties": {
        "value": {
          "type": [
            "number",
            "null"
          ],
          "minimum": 0
        },
        "numerator": {
          "type": "integer",
          "minimum": 0
        },
        "denominator": {
          "type": "integer",
          "minimum": 0
        }
      },
      "allOf": [
        {
          "if": {
            "properties": {
              "denominator": {
                "const": 0
              }
            },
            "required": [
              "denominator"
            ]
          },
          "then": {
            "properties": {
              "value": {
                "const": null
              }
            }
          }
        }
      ]
    },
    "consistencyValue": {
      "title": "A consistency figure, plus how many artifacts and pairs it was formed from",
      "description": "Aggregated with equal weight across every scored artifact that had at least two runs to compare (see bench/metrics/score.py's module docstring for why this module, not bench/README.md, fixes that convention). value is null when no artifact in this entry had two or more runs.",
      "type": "object",
      "required": [
        "value",
        "artifacts_with_pairs",
        "total_pairs"
      ],
      "additionalProperties": false,
      "properties": {
        "value": {
          "type": [
            "number",
            "null"
          ],
          "minimum": 0,
          "maximum": 1
        },
        "artifacts_with_pairs": {
          "title": "Artifacts with pairs",
          "description": "How many artifacts contributed a computable per-artifact consistency value to this entry's mean.",
          "type": "integer",
          "minimum": 0
        },
        "total_pairs": {
          "title": "Total pairs",
          "description": "Sum, across every contributing artifact, of the C(k, 2) unordered run pairs compared.",
          "type": "integer",
          "minimum": 0
        }
      },
      "allOf": [
        {
          "if": {
            "properties": {
              "artifacts_with_pairs": {
                "const": 0
              }
            },
            "required": [
              "artifacts_with_pairs"
            ]
          },
          "then": {
            "properties": {
              "value": {
                "const": null
              }
            }
          }
        }
      ]
    },
    "resultsVersion": {
      "title": "Results version",
      "description": "Version of this results format, versioned independently of both the plugin and the critique contract. This file validates 1.x results documents only.",
      "type": "string",
      "maxLength": 16,
      "pattern": "^1\\.(0|[1-9][0-9]*)\\.(0|[1-9][0-9]*)(?![\\s\\S])",
      "examples": [
        "1.0.0"
      ]
    },
    "semver": {
      "title": "Semantic version",
      "description": "Copied verbatim from the critique contract's semver. Semantic Versioning 2.0.0, with no leading v.",
      "type": "string",
      "maxLength": 64,
      "pattern": "^(0|[1-9][0-9]*)\\.(0|[1-9][0-9]*)\\.(0|[1-9][0-9]*)(?:-(?:0|[1-9][0-9]*|[0-9]*[A-Za-z-][0-9A-Za-z-]*)(?:\\.(?:0|[1-9][0-9]*|[0-9]*[A-Za-z-][0-9A-Za-z-]*))*)?(?:\\+[0-9A-Za-z-]+(?:\\.[0-9A-Za-z-]+)*)?(?![\\s\\S])"
    },
    "timestamp": {
      "title": "Timestamp",
      "description": "Copied verbatim from the critique contract's timestamp. RFC 3339 in UTC with a literal trailing Z, optional fractional seconds.",
      "type": "string",
      "format": "date-time",
      "pattern": "^[0-9]{4}-[0-9]{2}-[0-9]{2}T[0-9]{2}:[0-9]{2}:[0-9]{2}(?:\\.[0-9]{1,9})?Z(?![\\s\\S])"
    }
  }
}
