{
  "entries": [
    {
      "artifact_type": "markdown-prose",
      "artifacts_scored": 20,
      "clean_fp_rate": {
        "denominator": 5,
        "numerator": 17,
        "value": 3.4
      },
      "consistency": {
        "artifacts_with_pairs": 4,
        "total_pairs": 40,
        "value": 0.325
      },
      "consistency_exact": {
        "artifacts_with_pairs": 4,
        "total_pairs": 40,
        "value": 0.471
      },
      "domain": "microcopy",
      "lane": "judged",
      "model": "claude-haiku-4-5-20251001",
      "precision": {
        "denominator": 82,
        "numerator": 0,
        "value": 0.0
      },
      "precision_location": {
        "denominator": 82,
        "numerator": 44,
        "value": 0.537
      },
      "recall": {
        "denominator": 75,
        "numerator": 0,
        "value": 0.0
      },
      "recall_location": {
        "denominator": 75,
        "numerator": 44,
        "value": 0.587
      },
      "run_set": "bench-2026-10-28",
      "severity_agreement": {
        "denominator": 0,
        "numerator": 0,
        "value": null
      },
      "skill": "baseline-generic",
      "skill_version": "1.0.0",
      "unresolvable_claims": 13
    },
    {
      "artifact_type": "markdown-prose",
      "artifacts_scored": 20,
      "clean_fp_rate": {
        "denominator": 5,
        "numerator": 17,
        "value": 3.4
      },
      "consistency": {
        "artifacts_with_pairs": 4,
        "total_pairs": 40,
        "value": 0.325
      },
      "consistency_exact": {
        "artifacts_with_pairs": 4,
        "total_pairs": 40,
        "value": 0.471
      },
      "domain": "microcopy",
      "lane": "overall",
      "model": "claude-haiku-4-5-20251001",
      "precision": {
        "denominator": 82,
        "numerator": 0,
        "value": 0.0
      },
      "precision_location": {
        "denominator": 82,
        "numerator": 44,
        "value": 0.537
      },
      "recall": {
        "denominator": 75,
        "numerator": 0,
        "value": 0.0
      },
      "recall_location": {
        "denominator": 75,
        "numerator": 44,
        "value": 0.587
      },
      "run_set": "bench-2026-10-28",
      "severity_agreement": {
        "denominator": 0,
        "numerator": 0,
        "value": null
      },
      "skill": "baseline-generic",
      "skill_version": "1.0.0",
      "unresolvable_claims": 13
    },
    {
      "artifact_type": "markdown-prose",
      "artifacts_scored": 20,
      "clean_fp_rate": {
        "denominator": 5,
        "numerator": 0,
        "value": 0.0
      },
      "consistency": {
        "artifacts_with_pairs": 4,
        "total_pairs": 40,
        "value": 1.0
      },
      "consistency_exact": {
        "artifacts_with_pairs": 4,
        "total_pairs": 40,
        "value": 1.0
      },
      "domain": "microcopy",
      "lane": "scripted",
      "model": "claude-haiku-4-5-20251001",
      "precision": {
        "denominator": 0,
        "numerator": 0,
        "value": null
      },
      "precision_location": {
        "denominator": 0,
        "numerator": 0,
        "value": null
      },
      "recall": {
        "denominator": 75,
        "numerator": 0,
        "value": 0.0
      },
      "recall_location": {
        "denominator": 75,
        "numerator": 0,
        "value": 0.0
      },
      "run_set": "bench-2026-10-28",
      "severity_agreement": {
        "denominator": 0,
        "numerator": 0,
        "value": null
      },
      "skill": "baseline-generic",
      "skill_version": "1.0.0",
      "unresolvable_claims": 0
    },
    {
      "artifact_type": "markdown-prose",
      "artifacts_scored": 20,
      "clean_fp_rate": {
        "denominator": 5,
        "numerator": 0,
        "value": 0.0
      },
      "consistency": {
        "artifacts_with_pairs": 4,
        "total_pairs": 40,
        "value": 0.732
      },
      "consistency_exact": {
        "artifacts_with_pairs": 4,
        "total_pairs": 40,
        "value": 0.732
      },
      "domain": "microcopy",
      "lane": "judged",
      "model": "claude-haiku-4-5-20251001",
      "precision": {
        "denominator": 43,
        "numerator": 28,
        "value": 0.651
      },
      "precision_location": {
        "denominator": 43,
        "numerator": 40,
        "value": 0.93
      },
      "recall": {
        "denominator": 75,
        "numerator": 28,
        "value": 0.373
      },
      "recall_location": {
        "denominator": 75,
        "numerator": 40,
        "value": 0.533
      },
      "run_set": "bench-2026-10-28",
      "severity_agreement": {
        "denominator": 28,
        "numerator": 20,
        "value": 0.714
      },
      "skill": "critique-microcopy",
      "skill_version": "0.1.1",
      "unresolvable_claims": 0
    },
    {
      "artifact_type": "markdown-prose",
      "artifacts_scored": 20,
      "clean_fp_rate": {
        "denominator": 5,
        "numerator": 0,
        "value": 0.0
      },
      "consistency": {
        "artifacts_with_pairs": 4,
        "total_pairs": 40,
        "value": 0.763
      },
      "consistency_exact": {
        "artifacts_with_pairs": 4,
        "total_pairs": 40,
        "value": 0.763
      },
      "domain": "microcopy",
      "lane": "overall",
      "model": "claude-haiku-4-5-20251001",
      "precision": {
        "denominator": 76,
        "numerator": 61,
        "value": 0.803
      },
      "precision_location": {
        "denominator": 76,
        "numerator": 63,
        "value": 0.829
      },
      "recall": {
        "denominator": 75,
        "numerator": 61,
        "value": 0.813
      },
      "recall_location": {
        "denominator": 75,
        "numerator": 63,
        "value": 0.84
      },
      "run_set": "bench-2026-10-28",
      "severity_agreement": {
        "denominator": 61,
        "numerator": 53,
        "value": 0.869
      },
      "skill": "critique-microcopy",
      "skill_version": "0.1.1",
      "unresolvable_claims": 0
    },
    {
      "artifact_type": "markdown-prose",
      "artifacts_scored": 20,
      "clean_fp_rate": {
        "denominator": 5,
        "numerator": 0,
        "value": 0.0
      },
      "consistency": {
        "artifacts_with_pairs": 4,
        "total_pairs": 40,
        "value": 0.97
      },
      "consistency_exact": {
        "artifacts_with_pairs": 4,
        "total_pairs": 40,
        "value": 0.97
      },
      "domain": "microcopy",
      "lane": "scripted",
      "model": "claude-haiku-4-5-20251001",
      "precision": {
        "denominator": 33,
        "numerator": 33,
        "value": 1.0
      },
      "precision_location": {
        "denominator": 33,
        "numerator": 33,
        "value": 1.0
      },
      "recall": {
        "denominator": 75,
        "numerator": 33,
        "value": 0.44
      },
      "recall_location": {
        "denominator": 75,
        "numerator": 33,
        "value": 0.44
      },
      "run_set": "bench-2026-10-28",
      "severity_agreement": {
        "denominator": 33,
        "numerator": 33,
        "value": 1.0
      },
      "skill": "critique-microcopy",
      "skill_version": "0.1.1",
      "unresolvable_claims": 0
    }
  ],
  "generated_at": "2026-10-28T12:46:56Z",
  "results_version": "1.3.0",
  "run_set": "bench-2026-10-28"
}
